WO-2023196928-A2,True variant identification via multianalyte and multisample correlation ,"Mission Bio, Inc.","Adam SCIAMBI, Charles Joseph Murphy",2022-04-06,2023-04-06,2023-10-12,,https://patents.google.com/patent/WO2023196928A2/en,
WO-2021254585-A1,Method and system for detection and classification of clinically relevant structural genomic variations ,Geneton S.R.O.,"Micheala GÁŽIOVÁ, Jaroslav BUDIŠ, Werner KRAMPL, Marcel KUCHARĺK, Ondrej PÖS, Zuzana KUBIRITOVÁ, Ján RADVANSZKY, Tomáš SZEMES",2020-06-18,2020-06-18,2021-12-23,,https://patents.google.com/patent/WO2021254585A1/en,
CN-114566221-A,Automatic analysis and interpretation system for NGS data of genetic diseases ,上海交通大学医学院附属上海儿童医学中心,"王剑, 姚如恩, 李牛, 郁婷婷, 汤婕, 李国强",2022-03-04,2022-03-04,2022-05-31,,https://patents.google.com/patent/CN114566221A/en,https://patentimages.storage.googleapis.com/4f/d7/2c/b84fc2af9b6108/HDA0003531818610000011.png
CN-113039606-A,Methods and systems for pedigree enrichment and family-based analysis within pedigrees ,瑞泽恩制药公司,"J·斯特普尔斯, C·贡萨加-雅鲁吉, J·里德, L·哈贝格",2018-09-07,2019-09-06,2021-06-25,,https://patents.google.com/patent/CN113039606A/en,https://patentimages.storage.googleapis.com/ae/f1/c8/5c9813171c3a5b/HDA0002954547500000011.png
WO-2017074036-A2,Method and system for selecting customized drug using genomic nucleotide sequence variation information and survival information of cancer patient ,주식회사 싸이퍼롬,김주한,2015-10-26,2016-10-26,2017-05-04,,https://patents.google.com/patent/WO2017074036A2/en,https://patentimages.storage.googleapis.com/10/6c/83/580b8c38da37e9/PCTKR2016012108-appb-D000001.png
US-2025182843-A1,Systems and Methods for Analyzing Genetic Data for Assessment of Gene Regulatory Activity ,"The Trustees Of Princeton University, The Simons Foundation, Inc., The Board Of Regents Of The University Of Texas System","Olga G. Troyanskaya, Kathleen Chen, Jian Zhou",2021-06-21,2022-06-21,2025-06-05,,https://patents.google.com/patent/US20250182843A1/en,https://patentimages.storage.googleapis.com/ff/f6/3b/c86635e9ffe48b/US20250182843A1-20250605-D00000.png
CN-115458055-A,"Analysis method, system and equipment for predicting mutation pathogenicity based on target characteristics ",中国医学科学院北京协和医院,"吴南, 赵恒强, 杜华康, 赵森",2022-10-21,2022-10-21,2022-12-09,,https://patents.google.com/patent/CN115458055A/en,https://patentimages.storage.googleapis.com/6e/d3/ba/5ff838e56fed0f/HDA0003901214140000011.png
CN-112489727-A,Method and system for rapidly acquiring pathogenic site of rare disease ,厦门基源医疗科技有限公司,"陈詹妮, 陈荣山, 黄书鑫, 熊慧, 曾缘欢, 张丰丰, 王琳, 廖晓佳, 郭莉莎, 姚迅",2020-12-24,2020-12-24,2021-03-12,,https://patents.google.com/patent/CN112489727A/en,https://patentimages.storage.googleapis.com/78/6c/f3/c5eff1142fcefb/201223101932.png
CN-113239356-A,Malicious code classification method and device based on mixed texture features ,中国人民解放军国防科技大学,"沈毅, 郭徽, 张旻, 施凡, 马慧敏, 薛鹏飞, 胡淼",2021-07-12,2021-07-12,2021-08-10,,https://patents.google.com/patent/CN113239356A/en,https://patentimages.storage.googleapis.com/3e/e3/34/98f7b48f1dc81f/210708173038.png
CN-117660624-A,"Primers, mutants and applications for detecting Bosch-Boonstra-Schaaf optic atrophy syndrome ",湖南家辉生物技术有限公司,"曾桥, 罗娇娇, 郭鑫武, 徐霞, 刘鑫林",2023-12-06,2023-12-06,2024-03-08,,https://patents.google.com/patent/CN117660624A/en,
CN-116894968-A,Prioritization of training examples when training a classifier ,罗伯特·博世有限公司,"L·贝格尔, W·H·贝鲁施",2022-04-01,2023-03-31,2023-10-17,,https://patents.google.com/patent/CN116894968A/en,
EP-3192046-A1,"Centralized framework for storing, processing and utilizing proprietary genetic data ",Yougene Corp.,"Ryan Downs, Ferdinand LOS, Orhan Soykan, Roger Hahn",2014-09-11,2015-09-11,2017-07-19,,https://patents.google.com/patent/EP3192046A1/en,
CN-116590401-A,Mutation marker locus of ECHS1 gene of mitochondrial disease and application thereof ,"东阳市人民医院, 温州医科大学","王茂峰, 方合志, 强建玲, 王娅",2023-05-12,2023-05-12,2023-08-15,,https://patents.google.com/patent/CN116590401A/en,
CN-115458054-A,"Analysis method, system and equipment for predicting mutation pathogenicity based on SIGMA+ ",中国医学科学院北京协和医院,"吴南, 赵恒强, 杜华康, 赵森",2022-10-21,2022-10-21,2022-12-09,,https://patents.google.com/patent/CN115458054A/en,https://patentimages.storage.googleapis.com/21/5a/17/5f05ae9b65ba0c/HDA0003901211370000011.png
KR-20220086458-A,"Next-generation sequencing method for sharing genetic data, next-generation sequencing device and next-generation sequencing program ",연세대학교 산학협력단,"박유랑, 권솔비",2020-12-15,2021-07-26,2022-06-23,,https://patents.google.com/patent/KR20220086458A/en,https://patentimages.storage.googleapis.com/d3/0e/6a/a8d468b6d9f393/pat00001.png
WO-2023011723-A1,Identification of somatic variants ,Genome Research Limited,"Jyoti NANGALIA, Nicholas Williams",2021-08-05,2021-08-05,2023-02-09,,https://patents.google.com/patent/WO2023011723A1/en,
EP-3588506-B1,Systems and methods for genomic and genetic analysis ,Molecular Health GmbH,"Martin Dr. STEIN, Regina Dr. BOHNERT, Nora Dr. RIEBER",2018-06-29,2018-06-29,2021-11-10,2021-11-10,https://patents.google.com/patent/EP3588506B1/en,https://patentimages.storage.googleapis.com/ae/ab/b0/d8ff6be30f7e06/imgf0001.png
CN-116508105-A,Genomic marker interpolation based on haplotype blocks ,"科沃施种子欧洲股份两合公司, 哥廷根大学公法基金会","阿德南·尼姆, 托斯滕·波克",2020-10-09,2021-10-06,2023-07-28,,https://patents.google.com/patent/CN116508105A/en,
CN-111199778-A,RefGene gene library annotation method and device based on Spark SQL ,西安邮电大学,"吕宁, 吕致, 陈彦萍",2019-12-03,2019-12-03,2020-05-26,,https://patents.google.com/patent/CN111199778A/en,https://patentimages.storage.googleapis.com/80/2b/99/25a8a9bc93cb91/HDA0002300039480000011.png
CN-112037848-A,"Non-small cell lung cancer gene mutation and drug interpretation system, interpretation method and device ",荣联科技集团股份有限公司,"胡菲菲, 李明壮, 蔡文君, 李明明",2020-09-02,2020-09-02,2020-12-04,,https://patents.google.com/patent/CN112037848A/en,https://patentimages.storage.googleapis.com/05/bd/09/d9c449fb899c5e/HDA0002663734040000011.png
CN-116926180-A,Application of gene marker combinations in the preparation of diagnostic products for Noonan syndrome spectrum disorders ,广东省妇幼保健院（广东省妇产医院、广东省儿童医院）,"张彦, 黄演林, 刘渊, 王兴旺, 张琪, 丁红珂, 齐一鸣",2023-06-05,2023-06-05,2023-10-24,,https://patents.google.com/patent/CN116926180A/en,
WO-2023223330-A1,Identification of splicing disrupting mutations and use thereof ,Ramot At Tel-Aviv University Ltd.,"Tamir Tuller, Nicolas LYNN",2022-05-19,2023-05-18,2023-11-23,,https://patents.google.com/patent/WO2023223330A1/en,
CN-113278706-B,Method for distinguishing somatic mutation from germline mutation ,广州燃石医学检验所有限公司,"刘成林, 王俊, 张周, 揣少坤, 汉雨生",2021-07-23,2021-07-23,2021-11-12,2021-11-12,https://patents.google.com/patent/CN113278706B/en,https://patentimages.storage.googleapis.com/7f/67/d2/6b19c4a629e903/210715102020.png
EP-4162073-A2,Methods and systems for distinguishing somatic genomic sequences from germline genomic sequences ,"Foundation Medicine, Inc.","Yanmei HUANG, Jason D. HUGHES, Kyle GOWEN",2020-06-05,2021-06-03,2023-04-12,,https://patents.google.com/patent/EP4162073A2/en,
CN-116072288-A,Interpretation method and system for somatic cell diagnosis auxiliary decision ,上海申挚医疗科技有限公司,梅园,2022-12-27,2022-12-27,2023-05-05,,https://patents.google.com/patent/CN116072288A/en,https://patentimages.storage.googleapis.com/1e/47/3e/740caf620046fb/HDA0004019195760000011.png
US-2023343413-A1,Protein structure-based protein language models ,"Illumina, Inc., Illumina Cambridge Limited","Tobias HAMP, Hong Gao, Kai-How FARH",2021-10-06,2022-11-15,2023-10-26,,https://patents.google.com/patent/US20230343413A1/en,https://patentimages.storage.googleapis.com/23/b6/fa/ac67aee5f9612f/US20230343413A1-20231026-D00000.png
WO-2023164652-A2,Distributed genetic testing systems utilizing secure gateway systems and next-generation sequencing assays ,Aspira Women's Health,"Lesley NORTHRUP, Thomas Greco, Nitin Bhardwaj, Justin DEGRAZIA, Pierre DAVIDOFF",2022-02-25,2023-02-24,2023-08-31,,https://patents.google.com/patent/WO2023164652A2/en,
US-2022165414-A1,Automated Curation of Genetic Variants ,International Business Machines Corporation,"Elinor Dehan, Bhuvan Sharma, Claudia S. Huettner, Shang Xue, Kirk Alan Beaty, Himanshu Sharma",2020-11-20,2020-11-20,2022-05-26,,https://patents.google.com/patent/US20220165414A1/en,https://patentimages.storage.googleapis.com/43/41/d3/5bba607a7ca8af/US20220165414A1-20220526-D00000.png
CN-111816304-A,A method and system for the establishment of an aided decision-making for hereditary diseases ,北京聚道科技有限公司,"王玉梅, 李厦戎",2020-07-22,2020-07-22,2020-10-23,,https://patents.google.com/patent/CN111816304A/en,https://patentimages.storage.googleapis.com/3b/b3/03/afbca5e3758444/HDA0002595485350000011.png
WO-2021053349-A1,Kit and method of using kit ,Congenica Ltd.,"Nick Lench, Suzanne DRURY, Yogen Patel, Tim Rayner",2019-09-20,2020-09-18,2021-03-25,,https://patents.google.com/patent/WO2021053349A1/en,
US-2024105337-A1,System for managing genetic information associated with a human genome of a target subject and displayed via a graphical user interface (gui) ,John Trakadis,John Trakadis,2011-09-26,2023-12-01,2024-03-28,,https://patents.google.com/patent/US20240105337A1/en,https://patentimages.storage.googleapis.com/1a/24/a4/08183045504078/US20240105337A1-20240328-D00000.png
WO-2021148283-A1,Guided analysis of single cell sequencing data using bulk sequencing data ,Koninklijke Philips N.V.,"Jie Wu, Yee Him CHEUNG",2020-01-20,2021-01-13,2021-07-29,,https://patents.google.com/patent/WO2021148283A1/en,
WO-2019115657-A1,Methods for detecting variants in next-generation sequencing genomic data ,Sophia Genetics Sa,"David Hernandez, M. Zhenyu XU",2017-12-12,2018-12-12,2019-06-20,,https://patents.google.com/patent/WO2019115657A1/en,
KR-20190062543-A,Method and system for transmitting bioinformatics data ,게놈시스 에스에이,"기오르기오 조이아, 다니엘레 렌지",2016-10-11,2016-10-11,2019-06-05,,https://patents.google.com/patent/KR20190062543A/en,https://patentimages.storage.googleapis.com/14/29/ba/b22f622ef932db/pct00001.png
WO-2023129897-A1,Mask patterns for protein language models for predicting pathogenicity ,"Illumina, Inc., Illumina Cambridge Limited","Tobias HAMP, Anastasia Susanna Dagmar Dietrich, Jeffrey Mark Ede, Yibing Wu, Kai-How FARH",2021-12-29,2022-12-23,2023-07-06,,https://patents.google.com/patent/WO2023129897A1/en,
US-2023253070-A1,Systems and Methods for Detecting Cellular Pathway Dysregulation in Cancer Specimens ,"Tempus Labs, Inc.","Joshua Drews, Bonnie Dougherty, Lee Langer, Catherine Igartua, Andrew J. Sedgwick, Justin Guinney",2019-08-16,2023-02-28,2023-08-10,,https://patents.google.com/patent/US20230253070A1/en,https://patentimages.storage.googleapis.com/80/ac/be/e8d35213a10d9c/US20230253070A1-20230810-D00001.png
US-2024076751-A1,Variant classification through high-confidence mutation detection from fluorescence signals measured with a multiple mutation assay ,"Bio-Rad Laboratories, Inc.",Steven Okino,2022-09-02,2023-08-16,2024-03-07,,https://patents.google.com/patent/US20240076751A1/en,https://patentimages.storage.googleapis.com/3a/f3/40/f9883d90c2e7a4/US20240076751A1-20240307-D00000.png
WO-2022203705-A1,A precision medicine portal for human diseases ,Genome International Corporation,"Periannan Senapathy, Sudar SENAPATHY",2021-03-26,2021-08-20,2022-09-29,,https://patents.google.com/patent/WO2022203705A1/en,
US-10557821-B2,Methods and systems for variant detection ,Life Technologies Corporation,"David DENNY, David Woo, Manjula Aliminati, Siva Kumar Samsani, Stephanie Schneider, Yoke Peng Lim, Sylvia Chang",2015-04-15,2019-02-01,2020-02-11,2020-02-11,https://patents.google.com/patent/US10557821B2/en,https://patentimages.storage.googleapis.com/1f/bf/8a/4f4f5a63c330de/US10557821-20200211-D00000.png
WO-2015013191-A1,"Methods, systems, apparatus and their optimization for effective clinical analysis and conveying results thereof ","Dana-Farber Cancer Institute, Inc.","Levi A. Garraway, Eliezer M. VAN ALLEN, Nikhil Wagle",2013-07-21,2014-07-21,2015-01-29,,https://patents.google.com/patent/WO2015013191A1/en,
EP-3329406-A1,Systems and methods for prioritizing variants of unknown significance ,Koninklijke Philips N.V.,"Vartika AGRAWAL, Nevenka Dimitrova",2015-07-29,2016-07-26,2018-06-06,,https://patents.google.com/patent/EP3329406A1/en,
CA-3115658-A1,Modular expression systems for gene expression and methods of using same ,"Children's Hospital Medical Center, Paul R. Andreassen, Helmut Hanenberg","Paul R. Andreassen, Helmut Hanenberg",2018-10-12,2019-10-11,2020-05-22,,https://patents.google.com/patent/CA3115658A1/en,
US-2023029485-A1,"Methods for computational identification of functional changes to amino acid residues caused by genetic variants, and methods of computational prediction of chemotherapy efficacy using machine learning applied to gene expression data ",George Mason University,"Mohsin Saleet Jafri, Soukaina AMNIOUEL, John Russell HAMRE, III",2021-07-02,2022-07-01,2023-02-02,,https://patents.google.com/patent/US20230029485A1/en,https://patentimages.storage.googleapis.com/1c/ee/b2/79e5bc1bce9575/US20230029485A1-20230202-D00000.png
WO-2024107598-A1,Novel resistance genes associated with disease resistance in soybeans ,Syngenta Crop Protection Ag,"Qingli Liu, Euihwan CHUNG, Andrew David Farmer, John Daniel Hipskind, Yinping Lucy QIN, Xiaoping Tan",2022-11-14,2023-11-10,2024-05-23,,https://patents.google.com/patent/WO2024107598A1/en,
US-2024404624-A1,Structural variant alignment and variant calling by utilizing a structural-variant reference genome ,"Illumina, Inc.","Fan Zhang, Daniel Lee Cameron, Michael Ruehle, Sean Truong, Sujai Chari, Arun Subramaniyan, John Cooper Roddey",2023-05-31,2024-05-31,2024-12-05,,https://patents.google.com/patent/US20240404624A1/en,https://patentimages.storage.googleapis.com/a2/f1/3e/4a9b6803f19db5/US20240404624A1-20241205-D00000.png
CN-111383713-A,ctDNA detection and analysis device and method ,"北京安诺优达医学检验实验室有限公司, 安诺优达生命科学研究院, 安诺优达基因科技(北京)有限公司","于慧, 张美俊, 刘涛, 李大为, 玄兆伶, 王海良, 王娟, 肖飞",2018-12-29,2018-12-29,2020-07-07,,https://patents.google.com/patent/CN111383713A/en,https://patentimages.storage.googleapis.com/9e/a7/26/082ff7292ab6dd/HDA0001931456680000011.png
CN-115631791-A,"Germ line locus variation pathogenicity prediction method, device, terminal and medium ",上海睿璟生物科技有限公司,"张博, 杨峰, 石涵, 洪跟东",2022-10-28,2022-10-28,2023-01-20,,https://patents.google.com/patent/CN115631791A/en,https://patentimages.storage.googleapis.com/da/43/0c/f00145666dee3e/HDA0003915222520000011.png
US-2023064530-A1,Detection of Genetic Variants in Human Leukocyte Antigen Genes ,"Tempus Labs, Inc.","Ramit Bharanikumar, Karl Beutner, Jason Perera",2019-02-12,2022-07-29,2023-03-02,,https://patents.google.com/patent/US20230064530A1/en,https://patentimages.storage.googleapis.com/f2/37/e8/d9b0d9370f443c/US20230064530A1-20230302-D00001.png
JP-2024513994-A,Deep convolutional neural network predicts mutant virulence using three-dimensional (3D) protein structure ,"イルミナ インコーポレイテッド, イルミナ・ケンブリッジ・リミテッド","トビアス・ハンプ, ホン・ガオ, カイ－ハウ・ファー",2021-04-15,2022-04-14,2024-03-27,,https://patents.google.com/patent/JP2024513994A/en,
EP-4323989-A1,Efficient voxelization for deep learning ,"Illumina, Inc., Illumina Cambridge Limited","Tobias HAMP, Hong Gao, Kai-How FARH",2021-04-15,2022-04-14,2024-02-21,,https://patents.google.com/patent/EP4323989A1/en,
US-2023108368-A1,Combined and transfer learning of a variant pathogenicity predictor using gapped and non-gapped protein samples ,"Illumina, Inc., Illumina Cambridge Limited","Tobias HAMP, Hong Gao, Kai-How FARH",2021-10-06,2022-09-26,2023-04-06,,https://patents.google.com/patent/US20230108368A1/en,https://patentimages.storage.googleapis.com/ec/37/3a/7be93fc491aaaf/US20230108368A1-20230406-D00000.png
US-2022336056-A1,Multi-channel protein voxelization to predict variant pathogenicity using deep convolutional neural networks ,"Illumina, Inc., Illumina Cambridge Limited","Tobias HAMP, Kai-How FARH, Hong Gao",2021-04-15,2022-03-24,2022-10-20,,https://patents.google.com/patent/US20220336056A1/en,https://patentimages.storage.googleapis.com/3d/55/43/96373176d49e4a/US20220336056A1-20221020-D00000.png
CN-114882943-B,Method and device for analyzing somatic cell variation ,深圳裕康医学检验实验室,"杨露, 吴东方, 杨洁, 唐启覃, 陈龙昀, 陈丽, 王鹏, 邓乙晓, 徐嵘, 吴旭君, 许淑兰",2022-03-29,2022-03-29,2023-04-18,2023-04-18,https://patents.google.com/patent/CN114882943B/en,https://patentimages.storage.googleapis.com/ff/da/6f/39ea01406b8fc3/HDA0003571489550000011.png
WO-2020097660-A1,Methods of identifying genetic variants ,"The University Of Sydney, The Sydney Children’S Hospitals Network (Randwick And Westmead)","Sandra Cooper, Himanshu Joshi",2018-11-15,2019-11-15,2020-05-22,,https://patents.google.com/patent/WO2020097660A1/en,
CA-3219608-A1,Detection of human leukocyte antigen loss of heterozygosity ,"Tempus Labs, Inc., Ariane Lozac'hmeur, Jason PERERA, Tempus Ai, Inc.","Ariane Lozac'hmeur, Jason PERERA",2021-06-28,2021-07-16,2023-01-08,,https://patents.google.com/patent/CA3219608A1/en,
WO-2023129621-A1,Rare variant polygenic risk scores ,"Illumina, Inc.","Petko Plamenov Fiziev, Jeremy Francis Mcrae, Kai-How FARH",2021-12-29,2022-12-28,2023-07-06,,https://patents.google.com/patent/WO2023129621A1/en,
EP-4115428-A1,Genome dashboard ,The Research Institute at Nationwide Children's Hospital,"Simon N. LIN, Yungui HUANG, Seyed Scheil MOOSAVINASAB, Matthew Bailey, Robert VanDevender STROUSE, Rajeswari SWAMINATHAN, Katherine MILLER, Jeremy Patterson, Syed-Amad HUSSAIN, En JULIN",2020-03-06,2021-03-08,2023-01-11,,https://patents.google.com/patent/EP4115428A1/en,
WO-2024130230-A2,Systems and methods for evaluation of expression patterns ,"Orion Medicines, Inc.",Francois AGUET,2022-12-16,2023-12-16,2024-06-20,,https://patents.google.com/patent/WO2024130230A2/en,
KR-20180119522-A,"Method and system for tailored anti-cancer therapy based on the information of cancer genomic sequence variant, mRNA expression and patient survival ",주식회사 싸이퍼롬,"김혜현, 이정훈",2017-04-25,2018-04-25,2018-11-02,,https://patents.google.com/patent/KR20180119522A/en,https://patentimages.storage.googleapis.com/a5/99/82/aa62bb14b7835a/pat00008.png
CN-113793638-B,An Interpretation Method of Homologous Recombination Repairing Gene Variation ,"北京橡鑫生物科技有限公司, 天津橡鑫生物科技有限公司, 天津橡鑫医疗器械有限公司","曹善柏, 梁夏源, 郭璟, 楼峰",2021-11-15,2021-11-15,2022-03-25,2022-03-25,https://patents.google.com/patent/CN113793638B/en,https://patentimages.storage.googleapis.com/76/23/7f/4d98891e00b84e/211029142748.png
WO-2021231910-A1,Adjusted polygenic risk scores and calculation process ,The Scripps Research Institute,"Ali TORKAMANI, Nathan WINEINGER",2020-05-15,2021-05-14,2021-11-18,,https://patents.google.com/patent/WO2021231910A1/en,
US-2024029827-A1,Method for determining the pathogenicity/benignity of a genomic variant in connection with a given disease ,Engenome S.R.L.,"Ivan Limongelli, Giovanna Nicora",2020-08-04,2021-07-28,2024-01-25,,https://patents.google.com/patent/US20240029827A1/en,https://patentimages.storage.googleapis.com/7b/3b/c1/bd2fd74e07a29a/US20240029827A1-20240125-D00001.png
AU-2022324018-A1,Method and system for newborn screening for genetic diseases by whole genome sequencing ,Rady Children's Hospital Research Center,Stephen Kingsmore,2021-08-04,2022-08-03,2024-03-07,,https://patents.google.com/patent/AU2022324018A1/en,
CN-116312764-A,"Mutation hazard classification device, method and application thereof ",安诺优达基因科技(北京)有限公司,"刘云山, 杜洋, 王娟, 李志民",2021-12-31,2022-12-26,2023-06-23,,https://patents.google.com/patent/CN116312764A/en,https://patentimages.storage.googleapis.com/c1/6d/99/8fb41a3a3014c1/HDA0004018378840000011.png
US-2021398612-A1,Detecting tumor mutation burden with rna substrate ,"Genecentric Therapeutics, Inc., The University Of North Carolina At Chapel Hill","Greg MAYHEW, Yoichiro Shibata, Myla LAI-GOLDMAN, Charles PEROU, Joel Parker",2018-10-09,2019-10-09,2021-12-23,,https://patents.google.com/patent/US20210398612A1/en,https://patentimages.storage.googleapis.com/01/95/e3/a00bc05abe263e/US20210398612A1-20211223-D00000.png
US-12087400-B2,Genomic variant re-classification ,"Cerner Innovation, Inc.","Brad Sitler, Ayla Smith, Marshall Summar, Seth I. Berger",2020-12-29,2020-12-29,2024-09-10,2024-09-10,https://patents.google.com/patent/US12087400B2/en,https://patentimages.storage.googleapis.com/79/a0/8a/354289c0a6ecaa/US12087400-20240910-D00000.png
KR-20240095538-A,microsatellite marker ,캔써 리서치 테크놀로지 리미티드,"존 번, 마이클 스튜어트 잭슨, 프란시스코 마우로 산티바네즈-코레프, 리차드 갤론",2021-10-01,2022-10-03,2024-06-25,,https://patents.google.com/patent/KR20240095538A/en,
US-11587651-B2,Person-centric genomic services framework and integrated genomics platform and systems ,Merative Us L.P.,"Pengwei Yang, Cheryl L. Eifert, Kirk A. Beaty, Fang Wang",2019-03-08,2019-03-08,2023-02-21,2023-02-21,https://patents.google.com/patent/US11587651B2/en,https://patentimages.storage.googleapis.com/67/53/19/bb777237910f87/US11587651-20230221-D00000.png
EP-4566060-A1,Computer-implemented methods of identifying rare variants that cause extreme levels of gene expression ,"Illumina, Inc.","Kishore Jaganathan, Delasa AGHAMIRZAIE, Sofia Kyriazopoulou PANAGIOTOPOULOU, Kai-How FARH",2022-08-05,2023-07-21,2025-06-11,,https://patents.google.com/patent/EP4566060A1/en,
US-2022293214-A1,Methods of analyzing genetic variants based on genetic material ,"Fabric Genomics, Inc.",Mark Yandell,2019-09-05,2022-03-02,2022-09-15,,https://patents.google.com/patent/US20220293214A1/en,https://patentimages.storage.googleapis.com/04/8e/ff/93c2741c65a725/US20220293214A1-20220915-D00000.png
CA-3064223-A1,Deep learning-based techniques for pre-training deep convolutional neural networks ,"Illumina, Inc., Hong Gao, Kai-How FARH, Samskruthi REDDY PADIGEPATI","Hong Gao, Kai-How FARH, Samskruthi REDDY PADIGEPATI",2018-10-15,2019-05-09,2020-04-15,,https://patents.google.com/patent/CA3064223A1/en,
CN-109524060-B,Genetic disease risk prompting gene sequencing data processing system and processing method ,江苏科技大学,"诸峰, 张成红",2018-11-19,2018-11-19,2022-02-08,2022-02-08,https://patents.google.com/patent/CN109524060B/en,https://patentimages.storage.googleapis.com/83/73/be/8a7b6b554dbbdd/181116182708.png
CN-111797395-B,"Malicious code visualization and variant detection method, device, equipment and storage medium ",韩山师范学院,"余健, 冯健文, 黄伟",2020-06-28,2020-06-28,2023-08-29,2023-08-29,https://patents.google.com/patent/CN111797395B/en,
CN-118471329-A,"Gene mutation screening report method, system, electronic device and storage medium ","复旦大学附属儿科医院, 上海福君基因生物科技有限公司","吴冰冰, 卢宇蓝, 贾佳, 王慧君, 杨璐, 胡腾",2024-05-14,2024-05-14,2024-08-09,,https://patents.google.com/patent/CN118471329A/en,
WO-2021034484-A1,Methods for control of a sequencing device ,Life Technologies Corporation,"Jing Gao, Vidya KUDLINGAR, Dhirendrakumar RAI",2019-08-20,2020-07-31,2021-02-25,,https://patents.google.com/patent/WO2021034484A1/en,
EP-3670673-A1,Improved methods for diagnosis of lynch syndrome ,MGZ Tech GmbH,"Elke Holinski-Feder, Monika MORAK",2018-12-20,2018-12-20,2020-06-24,,https://patents.google.com/patent/EP3670673A1/en,https://patentimages.storage.googleapis.com/ae/f7/8c/c7cf391eb02e3e/imgf0001.png
US-11515010-B2,Deep convolutional neural networks to predict variant pathogenicity using three-dimensional (3D) protein structures ,"Illumina, Inc., Illumina Cambridge Limited","Tobias HAMP, Hong Gao, Kai-How FARH",2021-04-15,2021-09-07,2022-11-29,2022-11-29,https://patents.google.com/patent/US11515010B2/en,https://patentimages.storage.googleapis.com/f5/a9/95/4ab143c871494a/US11515010-20221129-D00000.png
GB-2591115-A,Screening system and method for acquiring and processing genomic information for generating gene variant interpretations ,Congenica Ltd,Mackay Emily,2020-01-16,2020-01-16,2021-07-21,,https://patents.google.com/patent/GB2591115A/en,
CN-118053537-B,Analysis report system for genetic variation of sudden cardiac death disease and application thereof ,中国医学科学院阜外医院,"周洲, 周维真, 张玉晶, 杨航, 李文轲, 孙洋, 殷昆仑",2024-03-04,2024-03-04,2024-08-06,2024-08-06,https://patents.google.com/patent/CN118053537B/en,
