CN-114627968-A,A multimodal omics data management system ,"四川大学华西医院, 华为技术有限公司, 赛乐基因科技(北京)有限公司","辜永红, 应志野, 陈一龙, 于浩澎, 赵顺存, 李斌杰, 张凯丽, 任沛, 成孝禹, 葛平, 周梦琳",2022-03-18,2022-03-18,2022-06-14,,https://patents.google.com/patent/CN114627968A/en,https://patentimages.storage.googleapis.com/8a/de/c2/e9652208059649/220311103604.png
CN-109637619-A,"Recognition methods, device, server and the medium of antimicrobial behavior are issued in violation of rules and regulations ",平安医疗健康管理股份有限公司,"陈明东, 黄越, 胥畅",2018-12-13,2018-12-13,2019-04-16,,https://patents.google.com/patent/CN109637619A/en,
CN-117603982-A,The p.P374TfsTer18 mutation causative gene of SQSTM1 in amyotrophic lateral sclerosis and its application ,中国医学科学院北京协和医院,"柳青, 张信哲, 沈东超, 王立静, 孙晔, 王高杰",2024-01-22,2024-01-22,2024-02-27,,https://patents.google.com/patent/CN117603982A/en,
CN-115458057-A,Analysis method of human gene full-exon detection data ,新疆碳智干细胞库有限公司,"黄卫东, 赵琼珍, 赵杰, 梁齐, 李彦奇, 张雪萍, 李继洋, 刘盼盼, 郭婕",2022-08-15,2022-08-15,2022-12-09,,https://patents.google.com/patent/CN115458057A/en,https://patentimages.storage.googleapis.com/13/23/dc/464ffef5ec3bbe/HDA0003796838500000011.png
EP-2971087-B1,Assessing dna quality using real-time pcr and ct values ,"Qiagen Sciences, LLC","Yexun Wang, John Dicarlo, Vikram DEVGAN, Qiong JIANG, Quan Peng",2013-03-14,2014-03-10,2017-11-01,2017-11-01,https://patents.google.com/patent/EP2971087B1/en,https://patentimages.storage.googleapis.com/22/b9/07/a4e6ba32ddd472/imgf0001.png
DE-102022122370-A1,Driver seat and side mirror based localization of 3D driver head position to optimize driver assistance functions ,GM Global Technology Operations LLC,"Xu Fang Zhao, Gaurav Talwar, Alaa M. Khamis",2021-10-26,2022-09-05,2023-04-27,,https://patents.google.com/patent/DE102022122370A1/en,https://patentimages.storage.googleapis.com/1f/02/6f/4272a1b6e6f5c7/DE102022122370A1_0007.png
US-10610521-B2,Biomarkers for response to rapamycin analogs ,Memorial Sloan Kettering Cancer Center,"James J. Hsieh, Michael Berger, Robert Motzer, Martin H. Voss, A Ari Hakimi, Can Pham, Emily Cheng, Angela Rose Brannon, Jianing Xu",2013-03-15,2015-09-14,2020-04-07,2020-04-07,https://patents.google.com/patent/US10610521B2/en,https://patentimages.storage.googleapis.com/15/75/46/32910685d4d3e6/US10610521-20200407-D00001.png
CN-113430195-A,"gRNA molecule of target beta-globin gene, its synthesis method and method for correcting mutation type ",海南苏生生物科技有限公司,"曾胜, 陈鑫苹, 杨宗繁, 丰玫玫, 王烨",2021-01-08,2021-05-07,2021-09-24,,https://patents.google.com/patent/CN113430195A/en,https://patentimages.storage.googleapis.com/54/ef/8e/d1158e9fc72ec6/962104DEST_PATH_HDA0003210296300000011.png
CN-111778233-A,Novel single base editing technology and application thereof ,中国科学院脑科学与智能技术卓越创新中心,"杨辉, 周昌阳",2019-04-04,2019-04-04,2020-10-16,,https://patents.google.com/patent/CN111778233A/en,https://patentimages.storage.googleapis.com/b4/c2/61/fa28069fe03744/HDA0002019011960000011.png
WO-2013110245-A1,Biomarkers for diabetes ,The Chinese University Of Hong Kong,"Juliana Chung-Ngor CHAN, Wing-Yee So, Ronald Ching-Wan MA",2012-01-27,2013-01-28,2013-08-01,,https://patents.google.com/patent/WO2013110245A1/en,
WO-2020159692-A1,Estimating latent reward functions from experiences ,Mayo Foundation For Medical Education And Research,"Nicholas CHIA, Iman J. KALANTARI",2019-01-28,2020-01-10,2020-08-06,,https://patents.google.com/patent/WO2020159692A1/en,
US-2016208248-A1,Neurocalcin Delta Inhibitors and Therapeutic and Non-Therapeutic Uses Thereof ,Universität Zu Köln,"Brunhilde Wirth, Markus Riessland",2013-07-29,2014-07-29,2016-07-21,,https://patents.google.com/patent/US20160208248A1/en,https://patentimages.storage.googleapis.com/53/90/26/ccf4823b4a3a27/US20160208248A1-20160721-D00001.png
TW-202311282-A,Compositions and vaccines for treating and/or preventing coronavirus variant infections and methods of using the same ,澳大利亞商恩吉尼克分子傳遞私人有限公司,"席曼許 布拉姆哈特, 珍妮佛 麥克戴爾米德",2021-07-22,2022-07-21,2023-03-16,,https://patents.google.com/patent/TW202311282A/en,https://patentimages.storage.googleapis.com/54/2f/a9/b2870865d3ed22/111127437-A0304-14-0001-1.png
JP-WO2006109424-A1,DNA encoding a protein having a function of forming and controlling a tree fiber cell wall of a plant trunk and its promoter DNA ,王子製紙株式会社,"佐藤　茂, 茂 佐藤, 奈々江 山田, 奈々江 山田, 志穂 中元, 志穂 中元, 隆 日尾野, 隆 日尾野",2005-03-31,2006-03-17,2008-10-16,,https://patents.google.com/patent/JPWO2006109424A1/en,
CN-120153070-A,Helicase-cytidine deaminase complexes and methods of use thereof ,因美纳有限公司,"G·斯佩恰莱, S·格罗斯, D·J·卓, L·Y·M·贝",2022-09-30,2023-09-29,2025-06-13,,https://patents.google.com/patent/CN120153070A/en,
CN-109344397-A,"The extracting method and device of text feature word, storage medium and program product ",东软集团股份有限公司,申勇,2018-09-03,2018-09-03,2019-02-15,,https://patents.google.com/patent/CN109344397A/en,
US-2012029298-A1,Linear classification method for determining acoustic physiological signal quality and device for use therein ,"Yongji Fu, Te-Chung Isaac Yang, Bryan Severt Hallberg","Yongji Fu, Te-Chung Isaac Yang, Bryan Severt Hallberg",2010-07-28,2010-07-28,2012-02-02,,https://patents.google.com/patent/US20120029298A1/en,https://patentimages.storage.googleapis.com/8f/51/79/f1c3478bc84969/US20120029298A1-20120202-D00000.png
EP-4121534-A1,Compositions and methods for treating subjects having a heterozygous alanine-glyoxylate aminotransferase gene (agxt) variant ,"Alnylam Pharmaceuticals, Inc.","Aimee M. DEATON, David ERBE",2020-03-18,2021-03-17,2023-01-25,,https://patents.google.com/patent/EP4121534A1/en,
CN-118800316-A,"Method for constructing HRD prediction model, application of HRD prediction model and CNA features ",上海科技大学,"刘雪松, 要慧子",2023-04-11,2023-04-11,2024-10-18,,https://patents.google.com/patent/CN118800316A/en,
CN-113373255-B,EST-SSR marker development and kit related to okra fruit color ,浙江省园林植物与花卉研究所(浙江省萧山棉麻研究所),"安霞, 应金耀, 周华萍, 金关荣, 骆霞红, 李文略, 柳婷婷, 陈常理, 朱关林, 何祯, 王翔, 楼旭平, 许亚俊, 李鲁峰",2021-06-16,2021-06-16,2024-07-23,2024-07-23,https://patents.google.com/patent/CN113373255B/en,
CN-115376608-A,R platform-based whole gene downstream analysis tool ,五邑大学,"周小青, 陈涛, 金银戈, 郑伟, 池玉娥, 汪金玲, 邹庆剑, 唐成程, 陈敏, 徐巨才, 陈静, 郭素琴, 赖良学",2022-08-15,2022-08-15,2022-11-22,,https://patents.google.com/patent/CN115376608A/en,https://patentimages.storage.googleapis.com/11/e8/28/4341ae2b54109a/HDA0003797935260000011.png
EP-4404962-A2,Piv5-based coronavirus vaccines and methods of use thereof ,Cyanvac LLC,"Zhuo Li, Biao He, Hong Jin, Ashley BEAVIS, Maria Cristina GINGERICH",2021-09-20,2022-09-20,2024-07-31,,https://patents.google.com/patent/EP4404962A2/en,
CN-110272994-B,Gene mutation diagnosis of CVM and application thereof ,中国医学科学院北京协和医院,"吴南, 吴志宏, 邱贵兴, 左宇志, 张元强, 赵森",2019-07-15,2019-07-15,2021-01-26,2021-01-26,https://patents.google.com/patent/CN110272994B/en,https://patentimages.storage.googleapis.com/f6/1b/df/c0da55241bb871/HDA0002130366770000011.png
JP-2023504582-A,Methods and compositions for providing identification and/or traceability of biological substances ,インデックス バイオシステムズ インク．,"マイケル ボルグ, ジェレミー エヌ． フリードバーグ",2019-11-26,2020-11-26,2023-02-03,,https://patents.google.com/patent/JP2023504582A/en,https://patentimages.storage.googleapis.com/a4/89/44/a75440dc794a3f/2023504582000026.png
CN-108876078-A,Calculate the method and dissipative system monitoring device of the improvement alternative of dissipative system performance ,株式会社日立制作所,单联柱,2017-05-10,2017-05-10,2018-11-23,,https://patents.google.com/patent/CN108876078A/en,
WO-2022203533-A1,Method for assessing predisposition to different forms of type ii diabetes mellitus ,Владимир Валерьевич ВОЛОБУЕВ,"Владимир Валерьевич ВОЛОБУЕВ, Ирина Станиславовна КОЛЕСНИКОВА, Валерий Владимирович ПОЛУНОВСКИЙ, Инна Сергеевна ХОЛЯНДРА, Софья Викторовна ДРУЖИНИНА, Василий Владимирович РЕШЕТНИКОВ, Наталья Александровна ЕРМОЛЕНКО",2021-03-25,2021-03-25,2022-09-29,,https://patents.google.com/patent/WO2022203533A1/en,
CN-111429967-A,Pacbio third-generation sequencing data processing methods ,"北京诺禾致源科技股份有限公司, 北京诺禾致源生物科技有限公司, 天津诺禾致源生物信息科技有限公司, 天津诺禾医学检验所有限公司, 南京诺禾致源生物科技有限公司","田仕林, 王雪涵, 曹丽蓉",2020-04-23,2020-04-23,2020-07-17,,https://patents.google.com/patent/CN111429967A/en,
WO-2020056004-A1,Methods and systems for multiplex gene amplification from ultra-low dna input amounts and uses thereof ,The Board Of Trustees Of The Lelandstanford Junior University,"Ronald W. Davis, Curt Scharfe, Peidong Shen, Ronald W. Davis",2018-09-11,2019-09-11,2020-03-19,,https://patents.google.com/patent/WO2020056004A1/en,
US-2023041309-A1,Compositions and vaccines for treating and/or preventing coronavirus variant infections and methods of using the same ,Engeneic Molecular Delivery Pty Ltd,"Himanshu Brahmbhatt, Jennifer MacDiarmid",2021-07-22,2022-07-21,2023-02-09,,https://patents.google.com/patent/US20230041309A1/en,https://patentimages.storage.googleapis.com/52/f8/85/5ce4bae5166321/US20230041309A1-20230209-D00000.png
CN-112094900-A,"Probe set for detecting monogenic recessive genetic disease, kit, screening method and application thereof ",福州数据技术研究院有限公司,张蕾,2020-09-28,2020-09-28,2020-12-18,,https://patents.google.com/patent/CN112094900A/en,
CN-110617617-A,Method and device for rapidly heating liquid ,厦门翔澧工业设计有限公司,赖秉豊,2019-02-01,2019-06-06,2019-12-27,,https://patents.google.com/patent/CN110617617A/en,
KR-20250019701-A,Composition and method for plasmapheresis ,"서큘레이트 헬스, 인크.",도브리 키프로프,2022-05-31,2023-05-31,2025-02-10,,https://patents.google.com/patent/KR20250019701A/en,https://patentimages.storage.googleapis.com/0d/63/cf/28aa347be32835/pct00011.png
DE-102020124997-A1,Procedure for calculating bulk material flow rates or bulk material loading of a vibrating machine ,Schenck Process Europe Gmbh,"Jan Schäfer, Viktor Rais",2020-09-25,2020-09-25,2022-03-31,,https://patents.google.com/patent/DE102020124997A1/en,https://patentimages.storage.googleapis.com/c3/fd/1c/d7af6a2f49c801/DE102020124997A1_0001.png
WO-2022023521-A2,Process for preparation of neopepitope-containing vaccine agents ,Evaxion Biotech A/S,"Thomas TROLLE, Christian Garde, Michael Schrantz KLAUSEN, Jens KRINGELUM",2020-07-30,2021-07-30,2022-02-03,,https://patents.google.com/patent/WO2022023521A2/en,
EP-3924850-B1,Process of constructing behaviour signatures of softwares ,Orange,"Baptiste OLIVIER, Xiao HAN",2019-02-14,2020-01-30,2024-08-28,2024-08-28,https://patents.google.com/patent/EP3924850B1/en,https://patentimages.storage.googleapis.com/6d/40/98/5a14608dae437e/imgf0001.png
WO-2019060835-A2,Validation of neoepitope presentation ,"Nant Holdings Ip, Llc","Kayvan Niazi, Nicholas J. Witchey",2017-09-25,2018-09-24,2019-03-28,,https://patents.google.com/patent/WO2019060835A2/en,
EP-3126528-B1,Methods for determining responsiveness to mek/erk inhibitors ,"Crown Bioscience, Inc. (Taicang)","Sheng Guo, Wubin QIAN, Jinying NING, Jing Zhang, Jixian Li, Zhu Mei",2014-04-04,2015-04-03,2021-08-18,2021-08-18,https://patents.google.com/patent/EP3126528B1/en,https://patentimages.storage.googleapis.com/06/2b/2a/1ed9b0d6d7d48a/imgf0001.png
CN-108977534-B,A kind of targeted sequencing kit and its using method and targeted sequencing method ,"江苏省人民医院, 上海源奇生物医药科技有限公司","李建勇, 缪祎, 徐卫, 范磊, 俞浩, 杨建清",2018-03-30,2018-03-30,2019-07-09,2019-07-09,https://patents.google.com/patent/CN108977534B/en,
CN-117438097-B,Method and system for predicting recurrence risk after early liver cancer operation ,南京普恩瑞生物科技有限公司,"朱燕萍, 杭雨晴, 谢剑邦, 黎旺长",2023-12-22,2023-12-22,2024-03-15,2024-03-15,https://patents.google.com/patent/CN117438097B/en,
WO-2020010409-A1,Detecting copy number variants ,Garvan Institute Of Medical Research,"Ben LUNDIE, Thomas OHNESORG, Mark COWLEY, André MINOCHE",2018-07-12,2019-07-12,2020-01-16,,https://patents.google.com/patent/WO2020010409A1/en,
CN-215050398-U,System for evaluating infertility related genes through fingertip blood detection ,和卓生物科技（上海）有限公司,"龚航, 陈家生",2020-11-20,2020-11-20,2021-12-07,2021-12-07,https://patents.google.com/patent/CN215050398U/en,https://patentimages.storage.googleapis.com/08/5d/39/dda45794924b29/HDA0002790172970000011.png
DE-102009053794-A1,"Method for producing flash file of e.g. commercial vehicle, involves read out information about preset plug connection, and assigning plug connection to input and/or output of electronic controller device based on virtual signal name ",Man Nutzfahrzeuge Ag,"Herbert Schäfer, Marc Witte",2009-11-18,2009-11-18,2011-05-19,,https://patents.google.com/patent/DE102009053794A1/en,https://patentimages.storage.googleapis.com/34/14/f0/c9a41284470bac/00130000.png
WO-2023122731-A2,A live attenuated mumps virus-based sars-cov-2 vaccine ,"Ohio State Innovation Foundation, Research Institute At Nationwide Children's Hospital","Jianrong Li, Mijia LU, Prosper N. BOYAKA, Mark PEEBLES, Yuexiu ZHANG, Mahesh K C",2021-12-22,2022-12-22,2023-06-29,,https://patents.google.com/patent/WO2023122731A2/en,
CN-110121271-A,The non-starch polysaccharide of microencapsulation for diet food composition ,主厨低卡食品有限公司,豪·皮奥·乔伊纳德,2016-11-07,2017-11-02,2019-08-13,,https://patents.google.com/patent/CN110121271A/en,
WO-2018027178-A1,Detecting mutations in circulating cell free dna to diagnose renal cell carcinoma ,Emory University,"John Petros, Rebecca ARNOLD, Kenneth Ogan, John PATTARAS, Michael Rossi, Viraj Master, David Roberts, Fei LIAN, Christopher Keith, Jeremy Goecks",2016-08-05,2017-08-04,2018-02-08,,https://patents.google.com/patent/WO2018027178A1/en,
DE-102021109973-A1,Process for the manufacture of hot-dip coated steel flat products ,Thyssenkrupp Steel Europe Ag,"Frank Vennemann, Nicole Wessel, Jennifer Schulz, Carsten Jansen, Silvia Bubelinyova",2021-04-20,2021-04-20,2022-10-20,,https://patents.google.com/patent/DE102021109973A1/en,https://patentimages.storage.googleapis.com/43/7e/dd/e389494c3834af/DE102021109973A1_0001.png
CN-108137532-A,The pyridin-3-yl acetogenin of inhibitor as human immunodeficiency virus replication ,Viiv保健英国第五有限公司,"J.F.卡多, B.N.奈杜, J.L.罗迈尼, P.西瓦普拉卡萨姆, D.R.圣劳伦特",2015-08-07,2016-08-03,2018-06-08,,https://patents.google.com/patent/CN108137532A/en,
CN-102081519-B,Method and device for collecting monitoring information of monitoring system ,胡玲霞,胡玲霞,2010-11-24,2010-11-24,2014-05-07,2014-05-07,https://patents.google.com/patent/CN102081519B/en,https://patentimages.storage.googleapis.com/0d/ea/fa/25a906716be14f/HDA0000050701240000011.png
BR-PI0801655-A2,method and apparatus for the determination of quantum properties ,Univ Rio De Janeiro,Luiz Eduardo Azambuja Sauerbronn,2008-05-21,2008-05-21,2011-07-19,,https://patents.google.com/patent/BRPI0801655A2/en,
CN-117025740-A,"Hu sheep pure breed identification method, identification terminal and application ",浙江大学,"费中华, 郭良勇, 陈金丽, 张云超, 陈曦, 王争光",2023-06-30,2023-06-30,2023-11-10,,https://patents.google.com/patent/CN117025740A/en,
WO-2024187173-A1,High throughput prime editing screens identify functional dna variants in the human genome ,The Regents Of The University Of California,"Yin Shen, Xingjie REN, Han Yang",2023-03-09,2024-03-09,2024-09-12,,https://patents.google.com/patent/WO2024187173A1/en,
EP-4104108-A1,Extraction of relevant signals from sparse data sets ,Quest Diagnostics Investments LLC,"Rebecca E. TAYLOR, Jennifer L. LAPIERRE",2020-02-13,2021-02-12,2022-12-21,,https://patents.google.com/patent/EP4104108A1/en,
CN-111909995-A,Gene combination for detecting single-gene hereditary cardiovascular disease and application thereof ,陈洪亮,"陈洪亮, 肖月, 郑海灵",2020-08-26,2020-08-26,2020-11-10,,https://patents.google.com/patent/CN111909995A/en,https://patentimages.storage.googleapis.com/c7/f1/4d/81929181a1aa44/HDA0002651060000000011.png
CN-117280683-A,Method and apparatus for encoding/decoding video ,交互数字Ce专利控股有限公司,"P·博尔德斯, F·加尔平, K·纳赛尔, 陈娅, T·杜马斯, A·罗伯特",2021-02-25,2022-02-22,2023-12-22,,https://patents.google.com/patent/CN117280683A/en,
EP-4307315-A1,Machine learning predictive models of treatment response ,Sophia Genetics SA,"Thierry COLIN, Antoine Huc, Olivier Gallinato, Jason Siffre, Floriane Gidel",2022-07-11,2022-07-11,2024-01-17,,https://patents.google.com/patent/EP4307315A1/en,https://patentimages.storage.googleapis.com/af/24/ef/c7fe5857b6db17/imgf0001.png
CN-116311303-A,"Gene detection report information identification method, system and equipment based on deep learning ",复旦大学附属妇产科医院,"康玉, 徐丛剑, 陈敏欣, 吴志勇, 郜意, 胥婧, 王辉, 郁培基",2023-03-15,2023-03-15,2023-06-23,,https://patents.google.com/patent/CN116311303A/en,https://patentimages.storage.googleapis.com/a7/4e/bd/f90ef76724e452/HDA0004128067140000011.png
US-2025201344-A1,Methods and systems for identifying an origin of a variant ,"Guardant Health, Inc.","Patrick C FIAUX, Mingyang Cai, Shile Zhang, Katie Julia QUINN, Che-Yu Lee",,2024-07-26,2025-06-19,,https://patents.google.com/patent/US20250201344A1/en,https://patentimages.storage.googleapis.com/a9/c7/d9/c1d380824903bb/US20250201344A1-20250619-D00000.png
US-2025125008-A1,Methods and systems for evaluation of sex biases in identifying molecular biomarkers for disease ,"Foundation Medicine, Inc.","Benjamin Kaplan, Jonathan Keith KILLIAN, Garrett M. FRAMPTON",2023-10-17,2024-10-14,2025-04-17,,https://patents.google.com/patent/US20250125008A1/en,https://patentimages.storage.googleapis.com/63/bb/cc/3931278aca5c58/US20250125008A1-20250417-D00000.png
WO-2025029645-A1,Methods and systems for identifying an origin of a variant ,"Guardant Health, Inc.","Patrick C. FIAUX, Mingyang CAI, Shile Zhang, Katie Julia QUINN, Chen-Yu Lee",2023-07-28,2024-07-26,2025-02-06,,https://patents.google.com/patent/WO2025029645A1/en,
WO-2025078500-A1,Selection of genomic variants through gene regulation modelling ,Instituto de Medicina Molecular João Lobo Antunes,"Ana ESPADA DE SOUSA, Alexandre RAPOSO, Pedro MOTA PREGO ROSMANINHO",2023-10-10,2024-10-10,2025-04-17,,https://patents.google.com/patent/WO2025078500A1/en,
US-2004015376-A1,Method and system to value projects taking into account political risks ,Conoco Inc.,"Kai Zhu, Helen El Mallakh",2002-07-03,2002-07-03,2004-01-22,,https://patents.google.com/patent/US20040015376A1/en,https://patentimages.storage.googleapis.com/2f/ea/b1/c36fccbc12f624/US20040015376A1-20040122-D00000.png
EP-1364046-B1,Methods for genetic analysis of dna to detect sequence variances ,"Variagenics, Inc.","Vincent P. Stanton, Jr., Jeffrey Olson, Martin Zillman",2000-05-23,2001-05-23,2011-11-30,2011-11-30,https://patents.google.com/patent/EP1364046B1/en,https://patentimages.storage.googleapis.com/c7/8b/d7/74e7fe3752e1ca/imgf0001.png
US-5452468-A,Computer system with parallel processing for information organization ,Peterson; Richard E.,Richard E. Peterson,1991-07-31,1991-07-31,1995-09-19,1995-09-19,https://patents.google.com/patent/US5452468A/en,https://patentimages.storage.googleapis.com/0b/62/cc/1fd796ed6b12db/US5452468-drawings-page-2.png
US-6915409-B1,Computerized information retrieval system ,Richard Esty Peterson,Richard Esty Peterson,1991-07-31,2003-08-22,2005-07-05,2005-07-05,https://patents.google.com/patent/US6915409B1/en,https://patentimages.storage.googleapis.com/c5/0c/43/36bbfcb5b70721/US06915409-20050705-D00000.png
US-5972602-A,Quantitative PCR-based method of gene detection ,"Australian Red Cross Society, The Council Of The Queensland Institute Of Medical Research","Catherine Hyland, Lindsay Colin Wolter, Allan Saul",1993-08-27,1996-02-27,1999-10-26,1999-10-26,https://patents.google.com/patent/US5972602A/en,https://patentimages.storage.googleapis.com/6d/b3/8d/20e634426f7f88/US5972602-drawings-page-2.png
GB-2606411-A,Immunogen selection and immunogenic compositions ,"Instadeep Ltd, BioNTech SE","Beguir Karim, Skwark Marcin, Pierrot Thomas, Fu Yunguan, Muik Alexander, PORAN Asaf, Liu Yunpeng, Sahin Ugur",2021-05-04,2021-05-07,2022-11-09,,https://patents.google.com/patent/GB2606411A/en,
US-2024271202-A1,Ultra high-fidelity single molecule sequencing ,New York University,Gilad Evrony,2023-01-31,2024-01-31,2024-08-15,,https://patents.google.com/patent/US20240271202A1/en,https://patentimages.storage.googleapis.com/6b/a6/c3/0a92ad3b48a2b1/US20240271202A1-20240815-D00000.png
CN-118562836-A,"Pathogenic gene causing von Gierke disease, detection and application ",湖南家辉生物技术有限公司,"谭小军, 曾桥, 徐霞, 薛雪冰",2024-05-28,2024-05-28,2024-08-30,,https://patents.google.com/patent/CN118562836A/en,
CN-118638757-A,"Primer combination, reagent and kit for detecting Hers disease, mutant protein, PYGL gene mutant and application thereof ",湖南家辉生物技术有限公司,"谭小军, 曾桥, 徐霞, 薛雪冰",2024-05-28,2024-05-28,2024-09-13,,https://patents.google.com/patent/CN118638757A/en,
CN-117761320-A,"Primer, gene mutant, mutant protein, reagent and application for detecting MRD8 type intellectual impairment ",湖南家辉生物技术有限公司,"曾桥, 师旋, 徐霞, 刘亚宁, 范园",2023-12-06,2023-12-06,2024-03-26,,https://patents.google.com/patent/CN117761320A/en,
US-2024363198-A1,System for identifying genetic variants and method thereof ,Cardiai Technologies,"Minal Borkar Tripathi, Sidharth Singh Bhinder, Anmol Singh KAPOOR, Amrita KAUR",2023-04-27,2024-04-26,2024-10-31,,https://patents.google.com/patent/US20240363198A1/en,https://patentimages.storage.googleapis.com/33/73/16/afd603e50945db/US20240363198A1-20241031-D00000.png
KR-20200106643-A,High sensitive genetic variation detection and reporting system based on barcode sequence information ,(주)인실리코젠,"이경표, 형기은, 김형용, 정은미, 강병철, 최남우",2019-03-05,2019-03-05,2020-09-15,,https://patents.google.com/patent/KR20200106643A/en,https://patentimages.storage.googleapis.com/bf/3d/08/f413c5dff3a9bb/pat00001.png
CN-118465284-A,"KDM5C mutant gene, protein, primer, reagent and application ",湖南家辉生物技术有限公司,"谭小军, 曾桥, 徐霞, 薛雪冰",2024-05-31,2024-05-31,2024-08-09,,https://patents.google.com/patent/CN118465284A/en,
US-2022223226-A1,Methods for detecting and characterizing microsatellite instability with high throughput sequencing ,Sophia Genetics S.A.,"Lin Song, Xiaboin XING, Zhenyu XU",2020-02-07,2021-02-05,2022-07-14,,https://patents.google.com/patent/US20220223226A1/en,https://patentimages.storage.googleapis.com/b7/53/0d/1015351a54031c/US20220223226A1-20220714-D00000.png
WO-2025101934-A1,Bypassing sanger confirmation for small variants in genetic disorder clinical testing ,Laboratory Corporation Of America Holdings,"Muqing YAN, Jennifer Elizabeth REINER, Qiandong Zeng, Stanley Ian Letovsky, Angela Antoinette KENYON, Natalia Tszine LEACH",2023-11-08,2024-11-08,2025-05-15,,https://patents.google.com/patent/WO2025101934A1/en,
CN-117487906-B,"GAMT gene mutant, reagent, kit and application ",湖南家辉生物技术有限公司,"曾桥, 刘亚宁, 徐霞",2023-12-29,2023-12-29,2024-05-31,2024-05-31,https://patents.google.com/patent/CN117487906B/en,
WO-2022261422-A9,Compositions and methods for mutations associated with sudden unexpected death in pediatrics (sudp) ,The Children's Medical Center Corporation,Richard D. GOLDSTEIN,2021-06-11,2022-06-10,2023-11-16,,https://patents.google.com/patent/WO2022261422A9/en,
WO-2024138018-A1,Treatment of gemin5-mediated disorders ,University Of Pittsburgh - Of The Commonwealth System Of Higher Education,"Udai PANDEY, Tyler FORTUNA, Sukhleen KOUR, Deepa SOUNDARA RAJAN",2022-12-23,2023-12-21,2024-06-27,,https://patents.google.com/patent/WO2024138018A1/en,
CN-117467761-B,"FKTN gene mutant, mutant protein, reagent, kit and application ",湖南家辉生物技术有限公司,"曾桥, 刘亚宁, 徐霞",2023-12-28,2023-12-28,2024-05-31,2024-05-31,https://patents.google.com/patent/CN117467761B/en,
WO-2023118199-A1,Proteomics-based stratification of acute myeolid leukaemia ,"Max-Planck-Gesellschaft Zur Förderung Der Wissenschaft E.V. (Mpg), Johann Wolfgang Goethe-Universität Frankfurt am Main, Deutsches Krebsforschungszentrum Stiftung Des Öffentlichen Rechts (Dkfz)","Matthias Mann, Ashok Kumar Jayavelu, Henning Urlaub, Thomas Oellerich, Sebastian Wolf, Hubert Serve, Florian Büttner",2021-12-22,2022-12-20,2023-06-29,,https://patents.google.com/patent/WO2023118199A1/en,
